[{"container-title":"Global Change Biology","author":[{"given":"S.","family":"LUYSSAERT"},{"given":"I.","family":"INGLIMA"},{"given":"M.","family":"JUNG"},{"given":"A. D.","family":"RICHARDSON"},{"given":"M.","family":"REICHSTEIN"},{"given":"D.","family":"PAPALE"},{"given":"S. L.","family":"PIAO"},{"given":"E. ‐D.","family":"SCHULZE"},{"given":"L.","family":"WINGATE"},{"given":"G.","family":"MATTEUCCI"},{"given":"L.","family":"ARAGAO"},{"given":"M.","family":"AUBINET"},{"given":"C.","family":"BEER"},{"given":"C.","family":"BERNHOFER"},{"given":"K. G.","family":"BLACK"},{"given":"D.","family":"BONAL"},{"given":"J. ‐M.","family":"BONNEFOND"},{"given":"J.","family":"CHAMBERS"},{"given":"P.","family":"CIAIS"},{"given":"B.","family":"COOK"},{"given":"K. J.","family":"DAVIS"},{"given":"A. J.","family":"DOLMAN"},{"given":"B.","family":"GIELEN"},{"given":"M.","family":"GOULDEN"},{"given":"J.","family":"GRACE"},{"given":"A.","family":"GRANIER"},{"given":"A.","family":"GRELLE"},{"given":"T.","family":"GRIFFIS"},{"given":"T.","family":"GRÜNWALD"},{"given":"G.","family":"GUIDOLOTTI"},{"given":"P. J.","family":"HANSON"},{"given":"R.","family":"HARDING"},{"given":"D. Y.","family":"HOLLINGER"},{"given":"L. R.","family":"HUTYRA"},{"given":"P.","family":"KOLARI"},{"given":"B.","family":"KRUIJT"},{"given":"W.","family":"KUTSCH"},{"given":"F.","family":"LAGERGREN"},{"given":"T.","family":"LAURILA"},{"given":"B. E.","family":"LAW"},{"given":"G.","family":"LE MAIRE"},{"given":"A.","family":"LINDROTH"},{"given":"D.","family":"LOUSTAU"},{"given":"Y.","family":"MALHI"},{"given":"J.","family":"MATEUS"},{"given":"M.","family":"MIGLIAVACCA"},{"given":"L.","family":"MISSON"},{"given":"L.","family":"MONTAGNANI"},{"given":"J.","family":"MONCRIEFF"},{"given":"E.","family":"MOORS"},{"given":"J. W.","family":"MUNGER"},{"given":"E.","family":"NIKINMAA"},{"given":"S. V.","family":"OLLINGER"},{"given":"G.","family":"PITA"},{"given":"C.","family":"REBMANN"},{"given":"O.","family":"ROUPSARD"},{"given":"N.","family":"SAIGUSA"},{"given":"M. J.","family":"SANZ"},{"given":"G.","family":"SEUFERT"},{"given":"C.","family":"SIERRA"},{"given":"M. ‐L.","family":"SMITH"},{"given":"J.","family":"TANG"},{"given":"R.","family":"VALENTINI"},{"given":"T.","family":"VESALA"},{"given":"I. A.","family":"JANSSENS"}],"DOI":"10.1111/j.1365-2486.2007.01439.x","type":"article-journal","id":"LUYSSAERT_2007","citation-key":"LUYSSAERT_2007","ISSN":"1365-2486","issue":"12","issued":{"date-parts":[[2007,8]]},"page":"2509-2537","publisher":"Wiley","title":"CO 2 balance of boreal, temperate, and tropical forests derived from a global database","URL":"http://dx.doi.org/10.1111/J.1365-2486.2007.01439.X","volume":"13","_graph":[{"type":"@biblatex/text","data":" @article{LUYSSAERT_2007, title={CO\n                    2\n                    balance of boreal, temperate, and tropical forests derived from a global database}, volume={13}, ISSN={1365-2486}, url={http://dx.doi.org/10.1111/J.1365-2486.2007.01439.X}, DOI={10.1111/j.1365-2486.2007.01439.x}, number={12}, journal={Global Change Biology}, publisher={Wiley}, author={LUYSSAERT, S. and INGLIMA, I. and JUNG, M. and RICHARDSON, A. D. and REICHSTEIN, M. and PAPALE, D. and PIAO, S. L. and SCHULZE, E. ‐D. and WINGATE, L. and MATTEUCCI, G. and ARAGAO, L. and AUBINET, M. and BEER, C. and BERNHOFER, C. and BLACK, K. G. and BONAL, D. and BONNEFOND, J. ‐M. and CHAMBERS, J. and CIAIS, P. and COOK, B. and DAVIS, K. J. and DOLMAN, A. J. and GIELEN, B. and GOULDEN, M. and GRACE, J. and GRANIER, A. and GRELLE, A. and GRIFFIS, T. and GRÜNWALD, T. and GUIDOLOTTI, G. and HANSON, P. J. and HARDING, R. and HOLLINGER, D. Y. and HUTYRA, L. R. and KOLARI, P. and KRUIJT, B. and KUTSCH, W. and LAGERGREN, F. and LAURILA, T. and LAW, B. E. and LE MAIRE, G. and LINDROTH, A. and LOUSTAU, D. and MALHI, Y. and MATEUS, J. and MIGLIAVACCA, M. and MISSON, L. and MONTAGNANI, L. and MONCRIEFF, J. and MOORS, E. and MUNGER, J. W. and NIKINMAA, E. and OLLINGER, S. V. and PITA, G. and REBMANN, C. and ROUPSARD, O. and SAIGUSA, N. and SANZ, M. J. and SEUFERT, G. and SIERRA, C. and SMITH, M. ‐L. and TANG, J. and VALENTINI, R. and VESALA, T. and JANSSENS, I. A.}, year={2007}, month=aug, pages={2509–2537} }\n"},{"type":"@biblatex/entries+list"},{"type":"@csl/list+object"}]}]